{
  "schema_version": 1,
  "contract_id": "radroots_event_codec.phase1_publication_media_readiness_v1",
  "authority_id": "phase1_publication_media_readiness_v1",
  "manifest_schema": {
    "path": "crates/event_codec/contracts/phase1_publication_media_readiness_v1.manifest.schema.json",
    "byte_length": 2845,
    "sha256": "5ba2b98ab59deb24b2d07f3df763560a421f47a68ea9973b72689d91bb790239",
    "hash_algorithm": "sha256_bytes_v1"
  },
  "predecessors": [
    {
      "contract_id": "radroots_event_codec.phase1_publication_allowlist_v1",
      "immutable_artifacts": [
        {
          "path": "crates/event_codec/contracts/phase1_publication_allowlist_v1.manifest.json",
          "byte_length": 10601,
          "sha256": "8629b5c547e8f9daad473ab9d570b206d00db134cc22b4d8e81be10d0f3d10ec",
          "hash_algorithm": "sha256_bytes_v1"
        },
        {
          "path": "crates/event_codec/contracts/phase1_publication_allowlist_v1.manifest.schema.json",
          "byte_length": 9016,
          "sha256": "638601348dece886ed9666251b5cf68d0a7f96c26dce115b65ed859a2db03d93",
          "hash_algorithm": "sha256_bytes_v1"
        },
        {
          "path": "crates/event_codec/contracts/phase1_publication_allowlist_v1.manifest.sha256",
          "byte_length": 65,
          "sha256": "4dd9bf6f230f02d8c2ca3c323e83fe9b77eb9f0895f708eb0949b7153b2fd6bd",
          "hash_algorithm": "sha256_bytes_v1"
        },
        {
          "path": "crates/event_codec/contracts/phase1_publication_allowlist_v1.descriptor.json",
          "byte_length": 1104,
          "sha256": "d7286a1206f822382226f28e2e601dc4f12cb743f9135238467092a31bde7bee",
          "hash_algorithm": "sha256_bytes_v1"
        },
        {
          "path": "contracts/conformance/vectors/publication/phase1_allowlist.v1.json",
          "byte_length": 49975,
          "sha256": "2867ee401db8cfad3a77869847c57567e869623f55d3d6c9e98a7fa0a643c3d6",
          "hash_algorithm": "sha256_bytes_v1"
        },
        {
          "path": "crates/event_codec/tests/fixtures/phase1_publication_allowlist.v1.json",
          "byte_length": 49975,
          "sha256": "2867ee401db8cfad3a77869847c57567e869623f55d3d6c9e98a7fa0a643c3d6",
          "hash_algorithm": "sha256_bytes_v1"
        },
        {
          "path": "crates/event_codec/tests/publication_allowlist.rs",
          "byte_length": 7562,
          "sha256": "342d3d3d1100cb5d31aca94b0540b1e03761b034de23475bdb5142baabeed8fd",
          "hash_algorithm": "sha256_bytes_v1"
        }
      ],
      "artifact_supersessions": [
        {
          "path": "crates/event_codec/tests/publication_artifact.rs",
          "byte_length": 34346,
          "sha256": "0e6d8b67b1793d66f4030d657cf09f86f66ad75226a19c4ef2a1fa2154534e14",
          "hash_algorithm": "sha256_bytes_v1"
        }
      ],
      "source_supersessions": [
        "CHANGELOG.md",
        "contracts/operations.toml",
        "contracts/releases/1.0.0-alpha.1.toml",
        "crates/event_codec/Cargo.toml",
        "crates/event_codec/src/wire/publication.rs",
        "crates/event_codec/tests/publication_artifact.rs",
        "tools/xtask/src/contract.rs",
        "tools/xtask/src/contract/nip09_reconciliation.rs",
        "tools/xtask/src/contract/phase1_publication_artifact.rs",
        "tools/xtask/src/contract/raw_source_rebuild.rs",
        "tools/xtask/src/main.rs"
      ]
    },
    {
      "contract_id": "radroots_blossom.publication_readiness_v1",
      "immutable_artifacts": [
        {
          "path": "crates/blossom/contracts/publication_readiness_v1.manifest.json",
          "byte_length": 13038,
          "sha256": "9359c5531548778b4a03e1a603a4048f17ba498b16dad50f7c62cca0ddb6240b",
          "hash_algorithm": "sha256_bytes_v1"
        },
        {
          "path": "crates/blossom/contracts/publication_readiness_v1.manifest.schema.json",
          "byte_length": 11884,
          "sha256": "e62ecf4b43bd03831f7e36e9cb4c98e2ed7e3a12d02cbca48a49e402b3feaa7d",
          "hash_algorithm": "sha256_bytes_v1"
        },
        {
          "path": "crates/blossom/contracts/publication_readiness_v1.manifest.sha256",
          "byte_length": 65,
          "sha256": "e8c2be84eef68e965ac0e119016d6840cb9503e58d5d9c40e13a6512e1ec74b7",
          "hash_algorithm": "sha256_bytes_v1"
        },
        {
          "path": "crates/blossom/contracts/publication_readiness_v1.descriptor.json",
          "byte_length": 1410,
          "sha256": "4a3b33eb2b04b5a56a99b7b5bed45988a0697cb28736bfd899e012f37fc02d93",
          "hash_algorithm": "sha256_bytes_v1"
        },
        {
          "path": "crates/blossom/contracts/publication_readiness_evidence_v1.schema.json",
          "byte_length": 1890,
          "sha256": "c8f5f3488dd91a660f8eaa018d9aba63d03c882dc3ff22b47ac192b7189b0ce2",
          "hash_algorithm": "sha256_bytes_v1"
        },
        {
          "path": "contracts/conformance/vectors/blossom/publication_readiness.v1.json",
          "byte_length": 16423,
          "sha256": "6408e3b5bc4a376c7411e304833431af918a4072f196e8a8da55c3f0ef8610c9",
          "hash_algorithm": "sha256_bytes_v1"
        },
        {
          "path": "crates/blossom/tests/fixtures/publication_readiness.v1.json",
          "byte_length": 16423,
          "sha256": "6408e3b5bc4a376c7411e304833431af918a4072f196e8a8da55c3f0ef8610c9",
          "hash_algorithm": "sha256_bytes_v1"
        },
        {
          "path": "crates/blossom/tests/publication_readiness.rs",
          "byte_length": 33431,
          "sha256": "17abd5491bcfe0c717f7f67202c8c2d85912a042167d027727c07d9f07306641",
          "hash_algorithm": "sha256_bytes_v1"
        },
        {
          "path": "contracts/conformance/vectors/blossom/publication_readiness_persistence.v1.json",
          "byte_length": 9264,
          "sha256": "e892ff6353afe8997a151a9aff4db2fd82c96d94db7bff31bc2269333adc2512",
          "hash_algorithm": "sha256_bytes_v1"
        },
        {
          "path": "crates/blossom/tests/fixtures/publication_readiness_persistence.v1.json",
          "byte_length": 9264,
          "sha256": "e892ff6353afe8997a151a9aff4db2fd82c96d94db7bff31bc2269333adc2512",
          "hash_algorithm": "sha256_bytes_v1"
        },
        {
          "path": "crates/blossom/tests/publication_readiness_persistence.rs",
          "byte_length": 11567,
          "sha256": "aa14d20ee5747fcc979907b4b59a67687a3a02852850e33aede65e2ab0e0ca8d",
          "hash_algorithm": "sha256_bytes_v1"
        }
      ],
      "artifact_supersessions": [
        {
          "path": "crates/blossom/tests/publication_readiness.rs",
          "byte_length": 31933,
          "sha256": "48796d2e4c171187fbf2efc66c5dd14e0510fc724baab5ffbd1dc156ba762c4b",
          "hash_algorithm": "sha256_bytes_v1"
        },
        {
          "path": "crates/blossom/tests/publication_readiness_persistence.rs",
          "byte_length": 11410,
          "sha256": "57c8576a1121c66996492eff79beada9f6a7287ec5fede295411dbb821ec4fad",
          "hash_algorithm": "sha256_bytes_v1"
        }
      ],
      "source_supersessions": [
        "CHANGELOG.md",
        "contracts/operations.toml",
        "contracts/releases/1.0.0-alpha.1.toml",
        "crates/blossom/tests/publication_readiness.rs",
        "crates/blossom/tests/publication_readiness_persistence.rs",
        "tools/xtask/src/contract.rs",
        "tools/xtask/src/contract/nip09_reconciliation.rs",
        "tools/xtask/src/contract/phase1_publication_artifact.rs",
        "tools/xtask/src/contract/raw_source_rebuild.rs",
        "tools/xtask/src/main.rs"
      ]
    }
  ],
  "protocol_sources": [
    {
      "id": "nostr_nips",
      "repository": "https://github.com/nostr-protocol/nips",
      "revision": "bdfa7e62ef87fcfcb992b1a27aee49d36b0b4f91"
    },
    {
      "id": "blossom",
      "repository": "https://github.com/hzrd149/blossom",
      "revision": "b5bd2801d1763aa635fc8fea7a76597e0eb18990"
    }
  ],
  "public_api": {
    "constants": [
      "RADROOTS_PHASE1_PUBLICATION_MEDIA_READINESS_BINDING_MAX_BYTES",
      "RADROOTS_PHASE1_PUBLICATION_MEDIA_READINESS_BINDING_SCHEMA_VERSION"
    ],
    "types": [
      "RadrootsPhase1MediaReadyPublicationArtifact",
      "RadrootsPhase1PublicationMediaReadinessBindingDigest",
      "RadrootsPhase1PublicationMediaReadinessError"
    ],
    "functions": [
      "bind_phase1_publication_media_readiness",
      "validate_phase1_publication_media_readiness"
    ],
    "methods": [
      "RadrootsPhase1MediaReadyPublicationArtifact::allowlisted_artifact",
      "RadrootsPhase1MediaReadyPublicationArtifact::artifact",
      "RadrootsPhase1MediaReadyPublicationArtifact::binding_digest",
      "RadrootsPhase1MediaReadyPublicationArtifact::canonical_json",
      "RadrootsPhase1MediaReadyPublicationArtifact::evidence",
      "RadrootsPhase1MediaReadyPublicationArtifact::from_canonical_json",
      "RadrootsPhase1MediaReadyPublicationArtifact::into_allowlisted_artifact",
      "RadrootsPhase1MediaReadyPublicationArtifact::to_canonical_json",
      "RadrootsPhase1PublicationMediaReadinessBindingDigest::as_bytes",
      "RadrootsPhase1PublicationMediaReadinessBindingDigest::to_hex",
      "RadrootsPhase1PublicationMediaReadinessError::code"
    ],
    "sealed_types": [
      "RadrootsPhase1MediaReadyPublicationArtifact",
      "RadrootsPhase1PublicationMediaReadinessBindingDigest"
    ]
  },
  "media_envelope": {
    "max_url_utf8_bytes": 4096,
    "min_raster_bytes": 1,
    "max_raster_bytes": 10485760,
    "media_types": [
      "image/jpeg",
      "image/png",
      "image/webp"
    ],
    "exact_dimension_variants": [
      "photo_update",
      "ask",
      "food_availability"
    ],
    "decoded_only_dimension_variants": [
      "profile",
      "event_date",
      "event_time"
    ]
  },
  "binding": {
    "schema_version": 1,
    "readiness_policy_version": 1,
    "schema": {